{
  "schemaVersion": "1.0",
  "domain": "planet_relationships",
  "description": "Thai Astrology Knowledge — Planet Relationship records. Loaded by PlanetRelationshipKnowledgeImporter into PlanetRelationshipKnowledge. Relations mirror the frozen PlanetRelationshipMatrix; provenance is pending verification (no invented references).",
  "relationships": [
    { "from": "sun", "to": "moon", "relation": "friend", "school": "unknown", "source": "Unknown", "author": null, "edition": null, "publisher": null, "year": null, "reference": "Unknown", "page": null, "quote": null, "confidence": "none", "status": "unknown", "verified": false, "notes": "Seeded from the frozen PlanetRelationshipMatrix; pending verification." },
    { "from": "sun", "to": "mars", "relation": "friend", "school": "unknown", "source": "Unknown", "author": null, "edition": null, "publisher": null, "year": null, "reference": "Unknown", "page": null, "quote": null, "confidence": "none", "status": "unknown", "verified": false, "notes": "Seeded from the frozen PlanetRelationshipMatrix; pending verification." },
    { "from": "sun", "to": "mercury", "relation": "neutral", "school": "unknown", "source": "Unknown", "author": null, "edition": null, "publisher": null, "year": null, "reference": "Unknown", "page": null, "quote": null, "confidence": "none", "status": "unknown", "verified": false, "notes": "Seeded from the frozen PlanetRelationshipMatrix; pending verification." },
    { "from": "sun", "to": "jupiter", "relation": "friend", "school": "unknown", "source": "Unknown", "author": null, "edition": null, "publisher": null, "year": null, "reference": "Unknown", "page": null, "quote": null, "confidence": "none", "status": "unknown", "verified": false, "notes": "Seeded from the frozen PlanetRelationshipMatrix; pending verification." },
    { "from": "sun", "to": "venus", "relation": "enemy", "school": "unknown", "source": "Unknown", "author": null, "edition": null, "publisher": null, "year": null, "reference": "Unknown", "page": null, "quote": null, "confidence": "none", "status": "unknown", "verified": false, "notes": "Seeded from the frozen PlanetRelationshipMatrix; pending verification." },
    { "from": "sun", "to": "saturn", "relation": "enemy", "school": "unknown", "source": "Unknown", "author": null, "edition": null, "publisher": null, "year": null, "reference": "Unknown", "page": null, "quote": null, "confidence": "none", "status": "unknown", "verified": false, "notes": "Seeded from the frozen PlanetRelationshipMatrix; pending verification." },
    { "from": "sun", "to": "rahu", "relation": "enemy", "school": "unknown", "source": "Unknown", "author": null, "edition": null, "publisher": null, "year": null, "reference": "Unknown", "page": null, "quote": null, "confidence": "none", "status": "unknown", "verified": false, "notes": "Seeded from the frozen PlanetRelationshipMatrix; pending verification." },

    { "from": "moon", "to": "sun", "relation": "friend", "school": "unknown", "source": "Unknown", "author": null, "edition": null, "publisher": null, "year": null, "reference": "Unknown", "page": null, "quote": null, "confidence": "none", "status": "unknown", "verified": false, "notes": "Seeded from the frozen PlanetRelationshipMatrix; pending verification." },
    { "from": "moon", "to": "mars", "relation": "neutral", "school": "unknown", "source": "Unknown", "author": null, "edition": null, "publisher": null, "year": null, "reference": "Unknown", "page": null, "quote": null, "confidence": "none", "status": "unknown", "verified": false, "notes": "Seeded from the frozen PlanetRelationshipMatrix; pending verification." },
    { "from": "moon", "to": "mercury", "relation": "friend", "school": "unknown", "source": "Unknown", "author": null, "edition": null, "publisher": null, "year": null, "reference": "Unknown", "page": null, "quote": null, "confidence": "none", "status": "unknown", "verified": false, "notes": "Seeded from the frozen PlanetRelationshipMatrix; pending verification." },
    { "from": "moon", "to": "jupiter", "relation": "neutral", "school": "unknown", "source": "Unknown", "author": null, "edition": null, "publisher": null, "year": null, "reference": "Unknown", "page": null, "quote": null, "confidence": "none", "status": "unknown", "verified": false, "notes": "Seeded from the frozen PlanetRelationshipMatrix; pending verification." },
    { "from": "moon", "to": "venus", "relation": "neutral", "school": "unknown", "source": "Unknown", "author": null, "edition": null, "publisher": null, "year": null, "reference": "Unknown", "page": null, "quote": null, "confidence": "none", "status": "unknown", "verified": false, "notes": "Seeded from the frozen PlanetRelationshipMatrix; pending verification." },
    { "from": "moon", "to": "saturn", "relation": "neutral", "school": "unknown", "source": "Unknown", "author": null, "edition": null, "publisher": null, "year": null, "reference": "Unknown", "page": null, "quote": null, "confidence": "none", "status": "unknown", "verified": false, "notes": "Seeded from the frozen PlanetRelationshipMatrix; pending verification." },
    { "from": "moon", "to": "rahu", "relation": "enemy", "school": "unknown", "source": "Unknown", "author": null, "edition": null, "publisher": null, "year": null, "reference": "Unknown", "page": null, "quote": null, "confidence": "none", "status": "unknown", "verified": false, "notes": "Seeded from the frozen PlanetRelationshipMatrix; pending verification." },

    { "from": "mars", "to": "sun", "relation": "friend", "school": "unknown", "source": "Unknown", "author": null, "edition": null, "publisher": null, "year": null, "reference": "Unknown", "page": null, "quote": null, "confidence": "none", "status": "unknown", "verified": false, "notes": "Seeded from the frozen PlanetRelationshipMatrix; pending verification." },
    { "from": "mars", "to": "moon", "relation": "friend", "school": "unknown", "source": "Unknown", "author": null, "edition": null, "publisher": null, "year": null, "reference": "Unknown", "page": null, "quote": null, "confidence": "none", "status": "unknown", "verified": false, "notes": "Seeded from the frozen PlanetRelationshipMatrix; pending verification." },
    { "from": "mars", "to": "mercury", "relation": "enemy", "school": "unknown", "source": "Unknown", "author": null, "edition": null, "publisher": null, "year": null, "reference": "Unknown", "page": null, "quote": null, "confidence": "none", "status": "unknown", "verified": false, "notes": "Seeded from the frozen PlanetRelationshipMatrix; pending verification." },
    { "from": "mars", "to": "jupiter", "relation": "friend", "school": "unknown", "source": "Unknown", "author": null, "edition": null, "publisher": null, "year": null, "reference": "Unknown", "page": null, "quote": null, "confidence": "none", "status": "unknown", "verified": false, "notes": "Seeded from the frozen PlanetRelationshipMatrix; pending verification." },
    { "from": "mars", "to": "venus", "relation": "neutral", "school": "unknown", "source": "Unknown", "author": null, "edition": null, "publisher": null, "year": null, "reference": "Unknown", "page": null, "quote": null, "confidence": "none", "status": "unknown", "verified": false, "notes": "Seeded from the frozen PlanetRelationshipMatrix; pending verification." },
    { "from": "mars", "to": "saturn", "relation": "neutral", "school": "unknown", "source": "Unknown", "author": null, "edition": null, "publisher": null, "year": null, "reference": "Unknown", "page": null, "quote": null, "confidence": "none", "status": "unknown", "verified": false, "notes": "Seeded from the frozen PlanetRelationshipMatrix; pending verification." },
    { "from": "mars", "to": "rahu", "relation": "neutral", "school": "unknown", "source": "Unknown", "author": null, "edition": null, "publisher": null, "year": null, "reference": "Unknown", "page": null, "quote": null, "confidence": "none", "status": "unknown", "verified": false, "notes": "Seeded from the frozen PlanetRelationshipMatrix; pending verification." },

    { "from": "mercury", "to": "sun", "relation": "friend", "school": "unknown", "source": "Unknown", "author": null, "edition": null, "publisher": null, "year": null, "reference": "Unknown", "page": null, "quote": null, "confidence": "none", "status": "unknown", "verified": false, "notes": "Seeded from the frozen PlanetRelationshipMatrix; pending verification." },
    { "from": "mercury", "to": "moon", "relation": "enemy", "school": "unknown", "source": "Unknown", "author": null, "edition": null, "publisher": null, "year": null, "reference": "Unknown", "page": null, "quote": null, "confidence": "none", "status": "unknown", "verified": false, "notes": "Seeded from the frozen PlanetRelationshipMatrix; pending verification." },
    { "from": "mercury", "to": "mars", "relation": "neutral", "school": "unknown", "source": "Unknown", "author": null, "edition": null, "publisher": null, "year": null, "reference": "Unknown", "page": null, "quote": null, "confidence": "none", "status": "unknown", "verified": false, "notes": "Seeded from the frozen PlanetRelationshipMatrix; pending verification." },
    { "from": "mercury", "to": "jupiter", "relation": "neutral", "school": "unknown", "source": "Unknown", "author": null, "edition": null, "publisher": null, "year": null, "reference": "Unknown", "page": null, "quote": null, "confidence": "none", "status": "unknown", "verified": false, "notes": "Seeded from the frozen PlanetRelationshipMatrix; pending verification." },
    { "from": "mercury", "to": "venus", "relation": "friend", "school": "unknown", "source": "Unknown", "author": null, "edition": null, "publisher": null, "year": null, "reference": "Unknown", "page": null, "quote": null, "confidence": "none", "status": "unknown", "verified": false, "notes": "Seeded from the frozen PlanetRelationshipMatrix; pending verification." },